title,authors,abstract,arxiv_id,link,date_published,date_updated,primary_category,categories,max_author_hindex
A Survey on Retrieval-Augmented Text Generation for Large Language Models,"['Yizheng Huang', 'Jimmy Huang']","Retrieval-Augmented Generation (RAG) merges retrieval methods with deep learning advancements to address the static limitations of large language models (LLMs) by enabling the dynamic integration of up-to-date external information. This methodology, focusing primarily on the text domain, provides a cost-effective solution to the generation of plausible but incorrect responses by LLMs, thereby enhancing the accuracy and reliability of their outputs through the use of real-world data. As RAG grows in complexity and incorporates multiple concepts that can influence its performance, this paper organizes the RAG paradigm into four categories: pre-retrieval, retrieval, post-retrieval, and generation, offering a detailed perspective from the retrieval viewpoint. It outlines RAG's evolution and discusses the field's progression through the analysis of significant studies. Additionally, the paper introduces evaluation methods for RAG, addressing the challenges faced and proposing future research directions. By offering an organized framework and categorization, the study aims to consolidate existing research on RAG, clarify its technological underpinnings, and highlight its potential to broaden the adaptability and applications of LLMs.",2404.10981,http://arxiv.org/abs/2404.10981v1,2024-04-17 01:27:42+00:00,2024-04-17 01:27:42+00:00,cs.IR,"['cs.IR', 'cs.AI', 'cs.CL']",0
Behavior Alignment: A New Perspective of Evaluating LLM-based Conversational Recommendation Systems,"['Dayu Yang', 'Fumian Chen', 'Hui Fang']","Large Language Models (LLMs) have demonstrated great potential in Conversational Recommender Systems (CRS). However, the application of LLMs to CRS has exposed a notable discrepancy in behavior between LLM-based CRS and human recommenders: LLMs often appear inflexible and passive, frequently rushing to complete the recommendation task without sufficient inquiry.This behavior discrepancy can lead to decreased accuracy in recommendations and lower user satisfaction. Despite its importance, existing studies in CRS lack a study about how to measure such behavior discrepancy. To fill this gap, we propose Behavior Alignment, a new evaluation metric to measure how well the recommendation strategies made by a LLM-based CRS are consistent with human recommenders'. Our experiment results show that the new metric is better aligned with human preferences and can better differentiate how systems perform than existing evaluation metrics. As Behavior Alignment requires explicit and costly human annotations on the recommendation strategies, we also propose a classification-based method to implicitly measure the Behavior Alignment based on the responses. The evaluation results confirm the robustness of the method.",2404.11773,http://arxiv.org/abs/2404.11773v1,2024-04-17 21:56:27+00:00,2024-04-17 21:56:27+00:00,cs.IR,"['cs.IR', 'cs.AI']",0
Generating Diverse Criteria On-the-Fly to Improve Point-wise LLM Rankers,"['Fang Guo', 'Wenyu Li', 'Honglei Zhuang', 'Yun Luo', 'Yafu Li', 'Le Yan', 'Yue Zhang']","The most recent pointwise Large Language Model (LLM) rankers have achieved remarkable ranking results. However, these rankers are hindered by two major drawbacks: (1) they fail to follow a standardized comparison guidance during the ranking process, and (2) they struggle with comprehensive considerations when dealing with complicated passages. To address these shortcomings, we propose to build a ranker that generates ranking scores based on a set of criteria from various perspectives. These criteria are intended to direct each perspective in providing a distinct yet synergistic evaluation. Our research, which examines eight datasets from the BEIR benchmark demonstrates that incorporating this multi-perspective criteria ensemble approach markedly enhanced the performance of pointwise LLM rankers.",2404.1196,http://arxiv.org/abs/2404.11960v1,2024-04-18 07:42:46+00:00,2024-04-18 07:42:46+00:00,cs.IR,"['cs.IR', 'cs.AI']",0
How Do Recommendation Models Amplify Popularity Bias? An Analysis from the Spectral Perspective,"['Siyi Lin', 'Chongming Gao', 'Jiawei Chen', 'Sheng Zhou', 'Binbin Hu', 'Can Wang']","Recommendation Systems (RS) are often plagued by popularity bias. Specifically,when recommendation models are trained on long-tailed datasets, they not only inherit this bias but often exacerbate it. This effect undermines both the precision and fairness of RS and catalyzes the so-called Matthew Effect. Despite the widely recognition of this issue, the fundamental causes remain largely elusive. In our research, we delve deeply into popularity bias amplification. Our comprehensive theoretical and empirical investigations lead to two core insights: 1) Item popularity is memorized in the principal singular vector of the score matrix predicted by the recommendation model; 2) The dimension collapse phenomenon amplifies the impact of principal singular vector on model predictions, intensifying the popularity bias. Based on these insights, we propose a novel method to mitigate this bias by imposing penalties on the magnitude of the principal singular value. Considering the heavy computational burden in directly evaluating the gradient of the principal singular value, we develop an efficient algorithm that harnesses the inherent properties of the singular vector. Extensive experiments across seven real-world datasets and three testing scenarios have been conducted to validate the superiority of our method.",2404.12008,http://arxiv.org/abs/2404.12008v1,2024-04-18 08:59:32+00:00,2024-04-18 08:59:32+00:00,cs.IR,"['cs.IR', 'cs.AI']",0
De-DSI: Decentralised Differentiable Search Index,"['Petru Neague', 'Marcel Gregoriadis', 'Johan Pouwelse']","This study introduces De-DSI, a novel framework that fuses large language models (LLMs) with genuine decentralization for information retrieval, particularly employing the differentiable search index (DSI) concept in a decentralized setting. Focused on efficiently connecting novel user queries with document identifiers without direct document access, De-DSI operates solely on query-docid pairs. To enhance scalability, an ensemble of DSI models is introduced, where the dataset is partitioned into smaller shards for individual model training. This approach not only maintains accuracy by reducing the number of data each model needs to handle but also facilitates scalability by aggregating outcomes from multiple models. This aggregation uses a beam search to identify top docids and applies a softmax function for score normalization, selecting documents with the highest scores for retrieval. The decentralized implementation demonstrates that retrieval success is comparable to centralized methods, with the added benefit of the possibility of distributing computational complexity across the network. This setup also allows for the retrieval of multimedia items through magnet links, eliminating the need for platforms or intermediaries.",2404.12237,http://arxiv.org/abs/2404.12237v1,2024-04-18 14:51:55+00:00,2024-04-18 14:51:55+00:00,cs.IR,"['cs.IR', 'cs.AI', 'cs.DC', 'I.2.7; I.2.11; H.3.3; C.2.4']",31
LLMTune: Accelerate Database Knob Tuning with Large Language Models,"['Xinmei Huang', 'Haoyang Li', 'Jing Zhang', 'Xinxin Zhao', 'Zhiming Yao', 'Yiyan Li', 'Zhuohao Yu', 'Tieying Zhang', 'Hong Chen', 'Cuiping Li']","Database knob tuning is a critical challenge in the database community, aiming to optimize knob values to enhance database performance for specific workloads. DBMS often feature hundreds of tunable knobs, posing a significant challenge for DBAs to recommend optimal configurations. Consequently, many machine learning-based tuning methods have been developed to automate this process. Despite the introduction of various optimizers, practical applications have unveiled a new problem: they typically require numerous workload runs to achieve satisfactory performance, a process that is both time-consuming and resource-intensive. This inefficiency largely stems from the optimal configuration often being substantially different from the default setting, necessitating multiple iterations during tuning. Recognizing this, we argue that an effective starting point could significantly reduce redundant exploration in less efficient areas, thereby potentially speeding up the tuning process for the optimizers. Based on this assumption, we introduce LLMTune, a large language model-based configuration generator designed to produce an initial, high-quality configuration for new workloads. These generated configurations can then serve as starting points for various base optimizers, accelerating their tuning processes. To obtain training data for LLMTune's supervised fine-tuning, we have devised a new automatic data generation framework capable of efficiently creating a large number of <workload, configuration> pairs. We have conducted thorough experiments to evaluate LLMTune's effectiveness with different workloads, such as TPC-H and JOB. In comparison to leading methods, LLMTune demonstrates a quicker ability to identify superior configurations. For instance, with the challenging TPC-H workload, our LLMTune achieves a significant 15.6x speed-up ratio in finding the best-performing configurations.",2404.11581,http://arxiv.org/abs/2404.11581v1,2024-04-17 17:28:05+00:00,2024-04-17 17:28:05+00:00,cs.AI,"['cs.AI', 'cs.DB']",0
Large Language Models meet Collaborative Filtering: An Efficient All-round LLM-based Recommender System,"['Sein Kim', 'Hongseok Kang', 'Seungyoon Choi', 'Donghyun Kim', 'Minchul Yang', 'Chanyoung Park']","Collaborative filtering recommender systems (CF-RecSys) have shown successive results in enhancing the user experience on social media and e-commerce platforms. However, as CF-RecSys struggles under cold scenarios with sparse user-item interactions, recent strategies have focused on leveraging modality information of user/items (e.g., text or images) based on pre-trained modality encoders and Large Language Models (LLMs). Despite their effectiveness under cold scenarios, we observe that they underperform simple traditional collaborative filtering models under warm scenarios due to the lack of collaborative knowledge. In this work, we propose an efficient All-round LLM-based Recommender system, called A-LLMRec, that excels not only in the cold scenario but also in the warm scenario. Our main idea is to enable an LLM to directly leverage the collaborative knowledge contained in a pre-trained state-of-the-art CF-RecSys so that the emergent ability of the LLM as well as the high-quality user/item embeddings that are already trained by the state-of-the-art CF-RecSys can be jointly exploited. This approach yields two advantages: (1) model-agnostic, allowing for integration with various existing CF-RecSys, and (2) efficiency, eliminating the extensive fine-tuning typically required for LLM-based recommenders. Our extensive experiments on various real-world datasets demonstrate the superiority of A-LLMRec in various scenarios, including cold/warm, few-shot, cold user, and cross-domain scenarios. Beyond the recommendation task, we also show the potential of A-LLMRec in generating natural language outputs based on the understanding of the collaborative knowledge by performing a favorite genre prediction task. Our code is available at https://github.com/ghdtjr/A-LLMRec .",2404.11343,http://arxiv.org/abs/2404.11343v1,2024-04-17 13:03:07+00:00,2024-04-17 13:03:07+00:00,cs.IR,"['cs.IR', 'cs.AI']",1
Unifying Bias and Unfairness in Information Retrieval: A Survey of Challenges and Opportunities with Large Language Models,"['Sunhao Dai', 'Chen Xu', 'Shicheng Xu', 'Liang Pang', 'Zhenhua Dong', 'Jun Xu']","With the rapid advancement of large language models (LLMs), information retrieval (IR) systems, such as search engines and recommender systems, have undergone a significant paradigm shift. This evolution, while heralding new opportunities, introduces emerging challenges, particularly in terms of biases and unfairness, which may threaten the information ecosystem. In this paper, we present a comprehensive survey of existing works on emerging and pressing bias and unfairness issues in IR systems when the integration of LLMs. We first unify bias and unfairness issues as distribution mismatch problems, providing a groundwork for categorizing various mitigation strategies through distribution alignment. Subsequently, we systematically delve into the specific bias and unfairness issues arising from three critical stages of LLMs integration into IR systems: data collection, model development, and result evaluation. In doing so, we meticulously review and analyze recent literature, focusing on the definitions, characteristics, and corresponding mitigation strategies associated with these issues. Finally, we identify and highlight some open problems and challenges for future work, aiming to inspire researchers and stakeholders in the IR field and beyond to better understand and mitigate bias and unfairness issues of IR in this LLM era. We also consistently maintain a GitHub repository for the relevant papers and resources in this rising direction at https://github.com/KID-22/LLM-IR-Bias-Fairness-Survey.",2404.11457,http://arxiv.org/abs/2404.11457v1,2024-04-17 15:05:03+00:00,2024-04-17 15:05:03+00:00,cs.IR,"['cs.IR', 'cs.AI', 'cs.CL']",25
When LLMs are Unfit Use FastFit: Fast and Effective Text Classification with Many Classes,"['Asaf Yehudai', 'Elron Bendel']","We present FastFit, a method, and a Python package design to provide fast and accurate few-shot classification, especially for scenarios with many semantically similar classes. FastFit utilizes a novel approach integrating batch contrastive learning and token-level similarity score. Compared to existing few-shot learning packages, such as SetFit, Transformers, or few-shot prompting of large language models via API calls, FastFit significantly improves multiclass classification performance in speed and accuracy across FewMany, our newly curated English benchmark, and Multilingual datasets. FastFit demonstrates a 3-20x improvement in training speed, completing training in just a few seconds. The FastFit package is now available on GitHub and PyPi, presenting a user-friendly solution for NLP practitioners.",2404.12365,http://arxiv.org/abs/2404.12365v1,2024-04-18 17:48:05+00:00,2024-04-18 17:48:05+00:00,cs.CL,"['cs.CL', 'cs.AI', 'cs.IR', 'cs.LG']",3
Optimizing Intensive Database Tasks Through Caching Proxy Mechanisms,"['Ionut-Alex Moise', 'Alexandra Băicoianu']","Web caching is essential for the World Wide Web, saving processing power, bandwidth, and reducing latency. Many proxy caching solutions focus on buffering data from the main server, neglecting cacheable information meant for server writes. Existing systems addressing this issue are often intrusive, requiring modifications to the main application for integration. We identify opportunities for enhancement in conventional caching proxies. This paper explores, designs, and implements a potential prototype for such an application. Our focus is on harnessing a faster bulk-data-write approach compared to single-data-write within the context of relational databases. If a (upload) request matches a specified cacheable URL, then the data will be extracted and buffered on the local disk for later bulk-write. In contrast with already existing caching proxies, Squid, for example, in a similar uploading scenario, the request would simply get redirected, leaving out potential gains such as minimized processing power, lower server load, and bandwidth. After prototyping and testing the suggested application against Squid, concerning data uploads with 1, 100, 1.000, ..., and 100.000 requests, we consistently observed query execution improvements ranging from 5 to 9 times. This enhancement was achieved through buffering and bulk-writing the data, the extent of which depended on the specific test conditions.",2404.12128,http://arxiv.org/abs/2404.12128v1,2024-04-18 12:29:03+00:00,2024-04-18 12:29:03+00:00,cs.DB,['cs.DB'],0
XMiner: Efficient Directed Subgraph Matching with Pattern Reduction,"['Pingpeng Yuan', 'Yujiang Wang', 'Tianyu Ma', 'Siyuan He', 'Ling Liu']","Graph pattern matching, one of the fundamental graph mining problems, aims to extract structural patterns of interest from an input graph. The state-of-the-art graph matching algorithms and systems are mainly designed for undirected graphs. Directed graph matching is more complex than undirected graph matching because the edge direction must be taken into account before the exploration of each directed edge. Thus, the technologies (e.g. storage, exploiting symmetry for graph matching) for undirected graph matching may not be fully applicable to directed graphs. For example, the redundancy implied in directed graph pattern can not be detected using the symmetry breaking for undirected pattern graph. Here, we present XMiner for efficient directed graph pattern matching whose core idea is 'pattern reduction'. It first analyzes the relationship between constraints implied in a pattern digraph. Then it reduces the pattern graph into a simplified form by finding a minimum constraint cover. Finally, XMiner generates an execution plan and follows it to extract matchings of the pattern graph. So, XMiner works on simplified pattern graph and avoids much data access and redundant computation throughout the matching process. Our experimental results show that XMiner outperforms state-of the-art stand-alone graph matching systems, and scales to complex graph pattern matching tasks on larger graph.",2404.11105,http://arxiv.org/abs/2404.11105v1,2024-04-17 06:42:26+00:00,2024-04-17 06:42:26+00:00,cs.DB,"['cs.DB', 'cs.DC']",0
Real-Time Trajectory Synthesis with Local Differential Privacy,"['Yujia Hu', 'Yuntao Du', 'Zhikun Zhang', 'Ziquan Fang', 'Lu Chen', 'Kai Zheng', 'Yunjun Gao']","Trajectory streams are being generated from location-aware devices, such as smartphones and in-vehicle navigation systems. Due to the sensitive nature of the location data, directly sharing user trajectories suffers from privacy leakage issues. Local differential privacy (LDP), which perturbs sensitive data on the user side before it is shared or analyzed, emerges as a promising solution for private trajectory stream collection and analysis. Unfortunately, existing stream release approaches often neglect the rich spatial-temporal context information within trajectory streams, resulting in suboptimal utility and limited types of downstream applications. To this end, we propose RetraSyn, a novel real-time trajectory synthesis framework, which is able to perform on-the-fly trajectory synthesis based on the mobility patterns privately extracted from users' trajectory streams. Thus, the downstream trajectory analysis can be performed on the high-utility synthesized data with privacy protection. We also take the genuine behaviors of real-world mobile travelers into consideration, ensuring authenticity and practicality. The key components of RetraSyn include the global mobility model, dynamic mobility update mechanism, real-time synthesis, and adaptive allocation strategy. We conduct extensive experiments on multiple real-world and synthetic trajectory datasets under various location-based utility metrics, encompassing both streaming and historical scenarios. The empirical results demonstrate the superiority and versatility of our proposed framework.",2404.1145,http://arxiv.org/abs/2404.11450v1,2024-04-17 14:55:49+00:00,2024-04-17 14:55:49+00:00,cs.DB,"['cs.DB', 'cs.CR']",0
Effective Individual Fairest Community Search over Heterogeneous Information Networks,"['Taige Zhao', 'Jianxin Li', 'Ningning Cui', 'Wei Luo']","Community search over heterogeneous information networks has been applied to wide domains, such as activity organization and team formation. From these scenarios, the members of a group with the same treatment often have different levels of activity and workloads, which causes unfairness in the treatment between active members and inactive members (called individual unfairness). However, existing works do not pay attention to individual fairness and do not sufficiently consider the rich semantics of HINs (e.g., high-order structure), which disables complex queries. To fill the gap, we formally define the issue of individual fairest community search over HINs (denoted as IFCS), which aims to find a set of vertices from the HIN that own the same type, close relationships, and small difference of activity level and has been demonstrated to be NP-hard. To do this, we first develop an exploration-based filter that reduces the search space of the community effectively. Further, to avoid repeating computation and prune unfair communities in advance, we propose a message-based scheme and a lower bound-based scheme. At last, we conduct extensive experiments on four real-world datasets to demonstrate the effectiveness and efficiency of our proposed algorithms, which achieve at least X3 times faster than the baseline solution.",2404.12107,http://arxiv.org/abs/2404.12107v1,2024-04-18 11:47:46+00:00,2024-04-18 11:47:46+00:00,cs.DB,"['cs.DB', 'cs.DS', 'cs.SI']",0
Causal Deconfounding via Confounder Disentanglement for Dual-Target Cross-Domain Recommendation,"['Jiajie Zhu', 'Yan Wang', 'Feng Zhu', 'Zhu Sun']","In recent years, dual-target Cross-Domain Recommendation (CDR) has been proposed to capture comprehensive user preferences in order to ultimately enhance the recommendation accuracy in both data-richer and data-sparser domains simultaneously. However, in addition to users' true preferences, the user-item interactions might also be affected by confounders (e.g., free shipping, sales promotion). As a result, dual-target CDR has to meet two challenges: (1) how to effectively decouple observed confounders, including single-domain confounders and cross-domain confounders, and (2) how to preserve the positive effects of observed confounders on predicted interactions, while eliminating their negative effects on capturing comprehensive user preferences. To address the above two challenges, we propose a Causal Deconfounding framework via Confounder Disentanglement for dual-target Cross-Domain Recommendation, called CD2CDR. In CD2CDR, we first propose a confounder disentanglement module to effectively decouple observed single-domain and cross-domain confounders. We then propose a causal deconfounding module to preserve the positive effects of such observed confounders and eliminate their negative effects via backdoor adjustment, thereby enhancing the recommendation accuracy in each domain. Extensive experiments conducted on five real-world datasets demonstrate that CD2CDR significantly outperforms the state-of-the-art methods.",2404.1118,http://arxiv.org/abs/2404.11180v1,2024-04-17 08:50:29+00:00,2024-04-17 08:50:29+00:00,cs.IR,['cs.IR'],0
A Learning-to-Rank Formulation of Clustering-Based Approximate Nearest Neighbor Search,"['Thomas Vecchiato', 'Claudio Lucchese', 'Franco Maria Nardini', 'Sebastian Bruch']","A critical piece of the modern information retrieval puzzle is approximate nearest neighbor search. Its objective is to return a set of $k$ data points that are closest to a query point, with its accuracy measured by the proportion of exact nearest neighbors captured in the returned set. One popular approach to this question is clustering: The indexing algorithm partitions data points into non-overlapping subsets and represents each partition by a point such as its centroid. The query processing algorithm first identifies the nearest clusters -- a process known as routing -- then performs a nearest neighbor search over those clusters only. In this work, we make a simple observation: The routing function solves a ranking problem. Its quality can therefore be assessed with a ranking metric, making the function amenable to learning-to-rank. Interestingly, ground-truth is often freely available: Given a query distribution in a top-$k$ configuration, the ground-truth is the set of clusters that contain the exact top-$k$ vectors. We develop this insight and apply it to Maximum Inner Product Search (MIPS). As we demonstrate empirically on various datasets, learning a simple linear function consistently improves the accuracy of clustering-based MIPS.",2404.11731,http://arxiv.org/abs/2404.11731v1,2024-04-17 20:34:41+00:00,2024-04-17 20:34:41+00:00,cs.IR,['cs.IR'],0
