title,authors,abstract,arxiv_id,link,date_published,date_updated,primary_category,categories,max_author_hindex
Concept Induction using LLMs: a user experiment for assessment,"['Adrita Barua', 'Cara Widmer', 'Pascal Hitzler']","Explainable Artificial Intelligence (XAI) poses a significant challenge in providing transparent and understandable insights into complex AI models. Traditional post-hoc algorithms, while useful, often struggle to deliver interpretable explanations. Concept-based models offer a promising avenue by incorporating explicit representations of concepts to enhance interpretability. However, existing research on automatic concept discovery methods is often limited by lower-level concepts, costly human annotation requirements, and a restricted domain of background knowledge. In this study, we explore the potential of a Large Language Model (LLM), specifically GPT-4, by leveraging its domain knowledge and common-sense capability to generate high-level concepts that are meaningful as explanations for humans, for a specific setting of image classification. We use minimal textual object information available in the data via prompting to facilitate this process. To evaluate the output, we compare the concepts generated by the LLM with two other methods: concepts generated by humans and the ECII heuristic concept induction system. Since there is no established metric to determine the human understandability of concepts, we conducted a human study to assess the effectiveness of the LLM-generated concepts. Our findings indicate that while human-generated explanations remain superior, concepts derived from GPT-4 are more comprehensible to humans compared to those generated by ECII.",2404.11875,http://arxiv.org/abs/2404.11875v1,2024-04-18 03:22:02+00:00,2024-04-18 03:22:02+00:00,cs.AI,['cs.AI'],2
"Enhancing Financial Inclusion and Regulatory Challenges: A Critical Analysis of Digital Banks and Alternative Lenders Through Digital Platforms, Machine Learning, and Large Language Models Integration",['Luke Lee'],"This paper explores the dual impact of digital banks and alternative lenders on financial inclusion and the regulatory challenges posed by their business models. It discusses the integration of digital platforms, machine learning (ML), and Large Language Models (LLMs) in enhancing financial services accessibility for underserved populations. Through a detailed analysis of operational frameworks and technological infrastructures, this research identifies key mechanisms that facilitate broader financial access and mitigate traditional barriers. Additionally, the paper addresses significant regulatory concerns involving data privacy, algorithmic bias, financial stability, and consumer protection. Employing a mixed-methods approach, which combines quantitative financial data analysis with qualitative insights from industry experts, this paper elucidates the complexities of leveraging digital technology to foster financial inclusivity. The findings underscore the necessity of evolving regulatory frameworks that harmonize innovation with comprehensive risk management. This paper concludes with policy recommendations for regulators, financial institutions, and technology providers, aiming to cultivate a more inclusive and stable financial ecosystem through prudent digital technology integration.",2404.11898,http://arxiv.org/abs/2404.11898v1,2024-04-18 05:00:53+00:00,2024-04-18 05:00:53+00:00,cs.AI,['cs.AI'],0
Sampling-based Pareto Optimization for Chance-constrained Monotone Submodular Problems,"['Xiankun Yan', 'Aneta Neumann', 'Frank Neumann']","Recently surrogate functions based on the tail inequalities were developed to evaluate the chance constraints in the context of evolutionary computation and several Pareto optimization algorithms using these surrogates were successfully applied in optimizing chance-constrained monotone submodular problems. However, the difference in performance between algorithms using the surrogates and those employing the direct sampling-based evaluation remains unclear. Within the paper, a sampling-based method is proposed to directly evaluate the chance constraint. Furthermore, to address the problems with more challenging settings, an enhanced GSEMO algorithm integrated with an adaptive sliding window, called ASW-GSEMO, is introduced. In the experiments, the ASW-GSEMO employing the sampling-based approach is tested on the chance-constrained version of the maximum coverage problem with different settings. Its results are compared with those from other algorithms using different surrogate functions. The experimental findings indicate that the ASW-GSEMO with the sampling-based evaluation approach outperforms other algorithms, highlighting that the performances of algorithms using different evaluation methods are comparable. Additionally, the behaviors of ASW-GSEMO are visualized to explain the distinctions between it and the algorithms utilizing the surrogate functions.",2404.11907,http://arxiv.org/abs/2404.11907v1,2024-04-18 05:15:20+00:00,2024-04-18 05:15:20+00:00,cs.AI,['cs.AI'],15
Toward Short-Term Glucose Prediction Solely Based on CGM Time Series,"['Ming Cheng', 'Xingjian Diao', 'Ziyi Zhou', 'Yanjun Cui', 'Wenjun Liu', 'Shitong Cheng']","The global diabetes epidemic highlights the importance of maintaining good glycemic control. Glucose prediction is a fundamental aspect of diabetes management, facilitating real-time decision-making. Recent research has introduced models focusing on long-term glucose trend prediction, which are unsuitable for real-time decision-making and result in delayed responses. Conversely, models designed to respond to immediate glucose level changes cannot analyze glucose variability comprehensively. Moreover, contemporary research generally integrates various physiological parameters (e.g. insulin doses, food intake, etc.), which inevitably raises data privacy concerns. To bridge such a research gap, we propose TimeGlu -- an end-to-end pipeline for short-term glucose prediction solely based on CGM time series data. We implement four baseline methods to conduct a comprehensive comparative analysis of the model's performance. Through extensive experiments on two contrasting datasets (CGM Glucose and Colas dataset), TimeGlu achieves state-of-the-art performance without the need for additional personal data from patients, providing effective guidance for real-world diabetic glucose management.",2404.11924,http://arxiv.org/abs/2404.11924v1,2024-04-18 06:02:12+00:00,2024-04-18 06:02:12+00:00,cs.AI,['cs.AI'],0
©Plug-in Authorization for Human Content Copyright Protection in Text-to-Image Model,"['Chao Zhou', 'Huishuai Zhang', 'Jiang Bian', 'Weiming Zhang', 'Nenghai Yu']","This paper addresses the contentious issue of copyright infringement in images generated by text-to-image models, sparking debates among AI developers, content creators, and legal entities. State-of-the-art models create high-quality content without crediting original creators, causing concern in the artistic community. To mitigate this, we propose the \copyright Plug-in Authorization framework, introducing three operations: addition, extraction, and combination. Addition involves training a \copyright plug-in for specific copyright, facilitating proper credit attribution. Extraction allows creators to reclaim copyright from infringing models, and combination enables users to merge different \copyright plug-ins. These operations act as permits, incentivizing fair use and providing flexibility in authorization. We present innovative approaches,""Reverse LoRA"" for extraction and ""EasyMerge"" for seamless combination. Experiments in artist-style replication and cartoon IP recreation demonstrate \copyright plug-ins' effectiveness, offering a valuable solution for human copyright protection in the age of generative AIs.",2404.11962,http://arxiv.org/abs/2404.11962v1,2024-04-18 07:48:00+00:00,2024-04-18 07:48:00+00:00,cs.AI,"['cs.AI', 'cs.CR', 'cs.CV', 'cs.LG']",0
From Language Models to Practical Self-Improving Computer Agents,['Alex Sheng'],"We develop a simple and straightforward methodology to create AI computer agents that can carry out diverse computer tasks and self-improve by developing tools and augmentations to enable themselves to solve increasingly complex tasks. As large language models (LLMs) have been shown to benefit from non-parametric augmentations, a significant body of recent work has focused on developing software that augments LLMs with various capabilities. Rather than manually developing static software to augment LLMs through human engineering effort, we propose that an LLM agent can systematically generate software to augment itself. We show, through a few case studies, that a minimal querying loop with appropriate prompt engineering allows an LLM to generate and use various augmentations, freely extending its own capabilities to carry out real-world computer tasks. Starting with only terminal access, we prompt an LLM agent to augment itself with retrieval, internet search, web navigation, and text editor capabilities. The agent effectively uses these various tools to solve problems including automated software development and web-based tasks.",2404.11964,http://arxiv.org/abs/2404.11964v1,2024-04-18 07:50:10+00:00,2024-04-18 07:50:10+00:00,cs.AI,"['cs.AI', '68T01', 'I.2.0']",0
"Exploring the landscape of large language models: Foundations, techniques, and challenges","['Milad Moradi', 'Ke Yan', 'David Colwell', 'Matthias Samwald', 'Rhona Asgari']","In this review paper, we delve into the realm of Large Language Models (LLMs), covering their foundational principles, diverse applications, and nuanced training processes. The article sheds light on the mechanics of in-context learning and a spectrum of fine-tuning approaches, with a special focus on methods that optimize efficiency in parameter usage. Additionally, it explores how LLMs can be more closely aligned with human preferences through innovative reinforcement learning frameworks and other novel methods that incorporate human feedback. The article also examines the emerging technique of retrieval augmented generation, integrating external knowledge into LLMs. The ethical dimensions of LLM deployment are discussed, underscoring the need for mindful and responsible application. Concluding with a perspective on future research trajectories, this review offers a succinct yet comprehensive overview of the current state and emerging trends in the evolving landscape of LLMs, serving as an insightful guide for both researchers and practitioners in artificial intelligence.",2404.11973,http://arxiv.org/abs/2404.11973v1,2024-04-18 08:01:20+00:00,2024-04-18 08:01:20+00:00,cs.AI,['cs.AI'],0
The Emerging AI Divide in the United States,"['Madeleine I. G. Daepp', 'Scott Counts']","The digital divide describes disparities in access to and usage of digital tooling between social and economic groups. Emerging generative artificial intelligence tools, which strongly affect productivity, could magnify the impact of these divides. However, the affordability, multi-modality, and multilingual capabilities of these tools could also make them more accessible to diverse users in comparison with previous forms of digital tooling. In this study, we characterize spatial differences in U.S. residents' knowledge of a new generative AI tool, ChatGPT, through an analysis of state- and county-level search query data. In the first six months after the tool's release, we observe the highest rates of users searching for ChatGPT in West Coast states and persistently low rates of search in Appalachian and Gulf states. Counties with the highest rates of search are relatively more urbanized and have proportionally more educated, more economically advantaged, and more Asian residents in comparison with other counties or with the U.S. average. In multilevel models adjusting for socioeconomic and demographic factors as well as industry makeup, education is the strongest positive predictor of rates of search for generative AI tooling. Although generative AI technologies may be novel, early differences in uptake appear to be following familiar paths of digital marginalization.",2404.11988,http://arxiv.org/abs/2404.11988v1,2024-04-18 08:33:35+00:00,2024-04-18 08:33:35+00:00,cs.AI,"['cs.AI', 'cs.CY', 'K.4.2']",0
DST-GTN: Dynamic Spatio-Temporal Graph Transformer Network for Traffic Forecasting,"['Songtao Huang', 'Hongjin Song', 'Tianqi Jiang', 'Akbar Telikani', 'Jun Shen', 'Qingguo Zhou', 'Binbin Yong', 'Qiang Wu']","Accurate traffic forecasting is essential for effective urban planning and congestion management. Deep learning (DL) approaches have gained colossal success in traffic forecasting but still face challenges in capturing the intricacies of traffic dynamics. In this paper, we identify and address this challenges by emphasizing that spatial features are inherently dynamic and change over time. A novel in-depth feature representation, called Dynamic Spatio-Temporal (Dyn-ST) features, is introduced, which encapsulates spatial characteristics across varying times. Moreover, a Dynamic Spatio-Temporal Graph Transformer Network (DST-GTN) is proposed by capturing Dyn-ST features and other dynamic adjacency relations between intersections. The DST-GTN can model dynamic ST relationships between nodes accurately and refine the representation of global and local ST characteristics by adopting adaptive weights in low-pass and all-pass filters, enabling the extraction of Dyn-ST features from traffic time-series data. Through numerical experiments on public datasets, the DST-GTN achieves state-of-the-art performance for a range of traffic forecasting tasks and demonstrates enhanced stability.",2404.11996,http://arxiv.org/abs/2404.11996v1,2024-04-18 08:44:52+00:00,2024-04-18 08:44:52+00:00,cs.AI,['cs.AI'],16
X-Light: Cross-City Traffic Signal Control Using Transformer on Transformer as Meta Multi-Agent Reinforcement Learner,"['Haoyuan Jiang', 'Ziyue Li', 'Hua Wei', 'Xuantang Xiong', 'Jingqing Ruan', 'Jiaming Lu', 'Hangyu Mao', 'Rui Zhao']","The effectiveness of traffic light control has been significantly improved by current reinforcement learning-based approaches via better cooperation among multiple traffic lights. However, a persisting issue remains: how to obtain a multi-agent traffic signal control algorithm with remarkable transferability across diverse cities? In this paper, we propose a Transformer on Transformer (TonT) model for cross-city meta multi-agent traffic signal control, named as X-Light: We input the full Markov Decision Process trajectories, and the Lower Transformer aggregates the states, actions, rewards among the target intersection and its neighbors within a city, and the Upper Transformer learns the general decision trajectories across different cities. This dual-level approach bolsters the model's robust generalization and transferability. Notably, when directly transferring to unseen scenarios, ours surpasses all baseline methods with +7.91% on average, and even +16.3% in some cases, yielding the best results.",2404.1209,http://arxiv.org/abs/2404.12090v1,2024-04-18 11:17:58+00:00,2024-04-18 11:17:58+00:00,cs.AI,['cs.AI'],11
Warped Time Series Anomaly Detection,"['Charlotte Lacoquelle', 'Xavier Pucel', 'Louise Travé-Massuyès', 'Axel Reymonet', 'Benoît Enaux']","This paper addresses the problem of detecting time series outliers, focusing on systems with repetitive behavior, such as industrial robots operating on production lines.Notable challenges arise from the fact that a task performed multiple times may exhibit different duration in each repetition and that the time series reported by the sensors are irregularly sampled because of data gaps. The anomaly detection approach presented in this paper consists of three stages.The first stage identifies the repetitive cycles in the lengthy time series and segments them into individual time series corresponding to one task cycle, while accounting for possible temporal distortions.The second stage computes a prototype for the cycles using a GPU-based barycenter algorithm, specifically tailored for very large time series.The third stage uses the prototype to detect abnormal cycles by computing an anomaly score for each cycle.The overall approach, named WarpEd Time Series ANomaly Detection (WETSAND), makes use of the Dynamic Time Warping algorithm and its variants because they are suited to the distorted nature of the time series.The experiments show that \wetsand scales to large signals, computes human-friendly prototypes, works with very little data, and outperforms some general purpose anomaly detection approaches such as autoencoders.",2404.12134,http://arxiv.org/abs/2404.12134v1,2024-04-18 12:35:24+00:00,2024-04-18 12:35:24+00:00,cs.AI,"['cs.AI', 'eess.SP']",0
Character is Destiny: Can Large Language Models Simulate Persona-Driven Decisions in Role-Playing?,"['Rui Xu', 'Xintao Wang', 'Jiangjie Chen', 'Siyu Yuan', 'Xinfeng Yuan', 'Jiaqing Liang', 'Zulong Chen', 'Xiaoqing Dong', 'Yanghua Xiao']","Can Large Language Models substitute humans in making important decisions? Recent research has unveiled the potential of LLMs to role-play assigned personas, mimicking their knowledge and linguistic habits. However, imitative decision-making requires a more nuanced understanding of personas. In this paper, we benchmark the ability of LLMs in persona-driven decision-making. Specifically, we investigate whether LLMs can predict characters' decisions provided with the preceding stories in high-quality novels. Leveraging character analyses written by literary experts, we construct a dataset LIFECHOICE comprising 1,401 character decision points from 395 books. Then, we conduct comprehensive experiments on LIFECHOICE, with various LLMs and methods for LLM role-playing. The results demonstrate that state-of-the-art LLMs exhibit promising capabilities in this task, yet there is substantial room for improvement. Hence, we further propose the CHARMAP method, which achieves a 6.01% increase in accuracy via persona-based memory retrieval. We will make our datasets and code publicly available.",2404.12138,http://arxiv.org/abs/2404.12138v1,2024-04-18 12:40:59+00:00,2024-04-18 12:40:59+00:00,cs.AI,['cs.AI'],0
AccidentBlip2: Accident Detection With Multi-View MotionBlip2,"['Yihua Shao', 'Hongyi Cai', 'Wenxin Long', 'Weiyi Lang', 'Zhe Wang', 'Haoran Wu', 'Yan Wang', 'Yang Yang', 'Zhen Lei']","Multimodal Large Language Models (MLLMs) have shown outstanding capabilities in many areas of multimodal reasoning. Therefore, we use the reasoning ability of Multimodal Large Language Models for environment description and scene understanding in complex transportation environments. In this paper, we propose AccidentBlip2, a multimodal large language model that can predict in real time whether an accident risk will occur. Our approach involves feature extraction based on the temporal scene of the six-view surround view graphs and temporal inference using the temporal blip framework through the vision transformer. We then input the generated temporal token into the MLLMs for inference to determine whether an accident will occur or not. Since AccidentBlip2 does not rely on any BEV images and LiDAR, the number of inference parameters and the inference cost of MLLMs can be significantly reduced, and it also does not incur a large training overhead during training. AccidentBlip2 outperforms existing solutions on the DeepAccident dataset and can also provide a reference solution for end-to-end automated driving accident prediction.",2404.12149,http://arxiv.org/abs/2404.12149v1,2024-04-18 12:54:25+00:00,2024-04-18 12:54:25+00:00,cs.AI,['cs.AI'],16
An Adaptive Metaheuristic Framework for Changing Environments,['Bestoun S. Ahmed'],"The rapidly changing landscapes of modern optimization problems require algorithms that can be adapted in real-time. This paper introduces an Adaptive Metaheuristic Framework (AMF) designed for dynamic environments. It is capable of intelligently adapting to changes in the problem parameters. The AMF combines a dynamic representation of problems, a real-time sensing system, and adaptive techniques to navigate continuously changing optimization environments. Through a simulated dynamic optimization problem, the AMF's capability is demonstrated to detect environmental changes and proactively adjust its search strategy. This framework utilizes a differential evolution algorithm that is improved with an adaptation module that adjusts solutions in response to detected changes. The capability of the AMF to adjust is tested through a series of iterations, demonstrating its resilience and robustness in sustaining solution quality despite the problem's development. The effectiveness of AMF is demonstrated through a series of simulations on a dynamic optimization problem. Robustness and agility characterize the algorithm's performance, as evidenced by the presented fitness evolution and solution path visualizations. The findings show that AMF is a practical solution to dynamic optimization and a major step forward in the creation of algorithms that can handle the unpredictability of real-world problems.",2404.12185,http://arxiv.org/abs/2404.12185v1,2024-04-18 13:47:53+00:00,2024-04-18 13:47:53+00:00,cs.AI,['cs.AI'],0
Relationship Discovery for Drug Recommendation,"['Xiang Li', 'Shunpan Liang', 'Yu Lei', 'Chen Li', 'Yulei Hou', 'Tengfei Ma']","Medication recommendation systems are designed to deliver personalized drug suggestions that are closely aligned with individual patient needs. Previous studies have primarily concentrated on developing medication embeddings, achieving significant progress. Nonetheless, these approaches often fall short in accurately reflecting individual patient profiles, mainly due to challenges in distinguishing between various patient conditions and the inability to establish precise correlations between specific conditions and appropriate medications. In response to these issues, we introduce DisMed, a model that focuses on patient conditions to enhance personalization. DisMed employs causal inference to discern clear, quantifiable causal links. It then examines patient conditions in depth, recognizing and adapting to the evolving nuances of these conditions, and mapping them directly to corresponding medications. Additionally, DisMed leverages data from multiple patient visits to propose combinations of medications. Comprehensive testing on real-world datasets demonstrates that DisMed not only improves the customization of patient profiles but also surpasses leading models in both precision and safety.",2404.12228,http://arxiv.org/abs/2404.12228v1,2024-04-18 14:44:08+00:00,2024-04-18 14:44:08+00:00,cs.AI,"['cs.AI', 'cs.LG']",4
Learning the Domain Specific Inverse NUFFT for Accelerated Spiral MRI using Diffusion Models,"['Trevor J. Chan', 'Chamith S. Rajapakse']","Deep learning methods for accelerated MRI achieve state-of-the-art results but largely ignore additional speedups possible with noncartesian sampling trajectories. To address this gap, we created a generative diffusion model-based reconstruction algorithm for multi-coil highly undersampled spiral MRI. This model uses conditioning during training as well as frequency-based guidance to ensure consistency between images and measurements. Evaluated on retrospective data, we show high quality (structural similarity > 0.87) in reconstructed images with ultrafast scan times (0.02 seconds for a 2D image). We use this algorithm to identify a set of optimal variable-density spiral trajectories and show large improvements in image quality compared to conventional reconstruction using the non-uniform fast Fourier transform. By combining efficient spiral sampling trajectories, multicoil imaging, and deep learning reconstruction, these methods could enable the extremely high acceleration factors needed for real-time 3D imaging.",2404.12361,http://arxiv.org/abs/2404.12361v1,2024-04-18 17:40:23+00:00,2024-04-18 17:40:23+00:00,cs.AI,"['cs.AI', 'physics.med-ph']",0
Music Enhancement with Deep Filters: A Technical Report for The ICASSP 2024 Cadenza Challenge,"['Keren Shao', 'Ke Chen', 'Shlomo Dubnov']","In this challenge, we disentangle the deep filters from the original DeepfilterNet and incorporate them into our Spec-UNet-based network to further improve a hybrid Demucs (hdemucs) based remixing pipeline. The motivation behind the use of the deep filter component lies at its potential in better handling temporal fine structures. We demonstrate an incremental improvement in both the Signal-to-Distortion Ratio (SDR) and the Hearing Aid Audio Quality Index (HAAQI) metrics when comparing the performance of hdemucs against different versions of our model.",2404.11116,http://arxiv.org/abs/2404.11116v1,2024-04-17 07:01:29+00:00,2024-04-17 07:01:29+00:00,cs.SD,"['cs.SD', 'cs.AI', 'cs.LG', 'cs.MM', 'eess.AS']",0
Mapping back and forth between model predictive control and neural networks,"['Ross Drummond', 'Pablo R Baldivieso-Monasterios', 'Giorgio Valmorbida']","Model predictive control (MPC) for linear systems with quadratic costs and linear constraints is shown to admit an exact representation as an implicit neural network. A method to ""unravel"" the implicit neural network of MPC into an explicit one is also introduced. As well as building links between model-based and data-driven control, these results emphasize the capability of implicit neural networks for representing solutions of optimisation problems, as such problems are themselves implicitly defined functions.",2404.1203,http://arxiv.org/abs/2404.12030v1,2024-04-18 09:29:08+00:00,2024-04-18 09:29:08+00:00,eess.SY,"['eess.SY', 'cs.AI', 'cs.SY']",0
