title,authors,abstract,arxiv_id,link,date_published,date_updated,primary_category,categories,max_author_hindex
What's under the hood: Investigating Automatic Metrics on Meeting Summarization,"['Frederic Kirstein', 'Jan Philip Wahle', 'Terry Ruas', 'Bela Gipp']","Meeting summarization has become a critical task considering the increase in online interactions. While new techniques are introduced regularly, their evaluation uses metrics not designed to capture meeting-specific errors, undermining effective evaluation. This paper investigates what the frequently used automatic metrics capture and which errors they mask by correlating automatic metric scores with human evaluations across a broad error taxonomy. We commence with a comprehensive literature review on English meeting summarization to define key challenges like speaker dynamics and contextual turn-taking and error types such as missing information and linguistic inaccuracy, concepts previously loosely defined in the field. We examine the relationship between characteristic challenges and errors by using annotated transcripts and summaries from Transformer-based sequence-to-sequence and autoregressive models from the general summary QMSum dataset. Through experimental validation, we find that different model architectures respond variably to challenges in meeting transcripts, resulting in different pronounced links between challenges and errors. Current default-used metrics struggle to capture observable errors, showing weak to mid-correlations, while a third of the correlations show trends of error masking. Only a subset reacts accurately to specific errors, while most correlations show either unresponsiveness or failure to reflect the error's impact on summary quality.",2404.11124,http://arxiv.org/abs/2404.11124v1,2024-04-17 07:15:07+00:00,2024-04-17 07:15:07+00:00,cs.CL,"['cs.CL', 'cs.AI']",0
Deep Neural Networks via Complex Network Theory: a Perspective,"['Emanuele La Malfa', 'Gabriele La Malfa', 'Giuseppe Nicosia', 'Vito Latora']","Deep Neural Networks (DNNs) can be represented as graphs whose links and vertices iteratively process data and solve tasks sub-optimally. Complex Network Theory (CNT), merging statistical physics with graph theory, provides a method for interpreting neural networks by analysing their weights and neuron structures. However, classic works adapt CNT metrics that only permit a topological analysis as they do not account for the effect of the input data. In addition, CNT metrics have been applied to a limited range of architectures, mainly including Fully Connected neural networks. In this work, we extend the existing CNT metrics with measures that sample from the DNNs' training distribution, shifting from a purely topological analysis to one that connects with the interpretability of deep learning. For the novel metrics, in addition to the existing ones, we provide a mathematical formalisation for Fully Connected, AutoEncoder, Convolutional and Recurrent neural networks, of which we vary the activation functions and the number of hidden layers. We show that these metrics differentiate DNNs based on the architecture, the number of hidden layers, and the activation function. Our contribution provides a method rooted in physics for interpreting DNNs that offers insights beyond the traditional input-output relationship and the CNT topological analysis.",2404.11172,http://arxiv.org/abs/2404.11172v2,2024-04-17 08:42:42+00:00,2024-04-18 11:17:43+00:00,cs.LG,"['cs.LG', 'cs.AI']",0
KI-GAN: Knowledge-Informed Generative Adversarial Networks for Enhanced Multi-Vehicle Trajectory Forecasting at Signalized Intersections,"['Chuheng Wei', 'Guoyuan Wu', 'Matthew J. Barth', 'Amr Abdelraouf', 'Rohit Gupta', 'Kyungtae Han']","Reliable prediction of vehicle trajectories at signalized intersections is crucial to urban traffic management and autonomous driving systems. However, it presents unique challenges, due to the complex roadway layout at intersections, involvement of traffic signal controls, and interactions among different types of road users. To address these issues, we present in this paper a novel model called Knowledge-Informed Generative Adversarial Network (KI-GAN), which integrates both traffic signal information and multi-vehicle interactions to predict vehicle trajectories accurately. Additionally, we propose a specialized attention pooling method that accounts for vehicle orientation and proximity at intersections. Based on the SinD dataset, our KI-GAN model is able to achieve an Average Displacement Error (ADE) of 0.05 and a Final Displacement Error (FDE) of 0.12 for a 6-second observation and 6-second prediction cycle. When the prediction window is extended to 9 seconds, the ADE and FDE values are further reduced to 0.11 and 0.26, respectively. These results demonstrate the effectiveness of the proposed KI-GAN model in vehicle trajectory prediction under complex scenarios at signalized intersections, which represents a significant advancement in the target field.",2404.11181,http://arxiv.org/abs/2404.11181v1,2024-04-17 08:53:59+00:00,2024-04-17 08:53:59+00:00,cs.LG,"['cs.LG', 'cs.AI', 'cs.RO']",11
Exploring the Transferability of Visual Prompting for Multimodal Large Language Models,"['Yichi Zhang', 'Yinpeng Dong', 'Siyuan Zhang', 'Tianzan Min', 'Hang Su', 'Jun Zhu']","Although Multimodal Large Language Models (MLLMs) have demonstrated promising versatile capabilities, their performance is still inferior to specialized models on downstream tasks, which makes adaptation necessary to enhance their utility. However, fine-tuning methods require independent training for every model, leading to huge computation and memory overheads. In this paper, we propose a novel setting where we aim to improve the performance of diverse MLLMs with a group of shared parameters optimized for a downstream task. To achieve this, we propose Transferable Visual Prompting (TVP), a simple and effective approach to generate visual prompts that can transfer to different models and improve their performance on downstream tasks after trained on only one model. We introduce two strategies to address the issue of cross-model feature corruption of existing visual prompting methods and enhance the transferability of the learned prompts, including 1) Feature Consistency Alignment: which imposes constraints to the prompted feature changes to maintain task-agnostic knowledge; 2) Task Semantics Enrichment: which encourages the prompted images to contain richer task-specific semantics with language guidance. We validate the effectiveness of TVP through extensive experiments with 6 modern MLLMs on a wide variety of tasks ranging from object recognition and counting to multimodal reasoning and hallucination correction.",2404.11207,http://arxiv.org/abs/2404.11207v1,2024-04-17 09:39:07+00:00,2024-04-17 09:39:07+00:00,cs.CV,"['cs.CV', 'cs.AI', 'cs.LG']",0
Feature Corrective Transfer Learning: End-to-End Solutions to Object Detection in Non-Ideal Visual Conditions,"['Chuheng Wei', 'Guoyuan Wu', 'Matthew J. Barth']","A significant challenge in the field of object detection lies in the system's performance under non-ideal imaging conditions, such as rain, fog, low illumination, or raw Bayer images that lack ISP processing. Our study introduces ""Feature Corrective Transfer Learning"", a novel approach that leverages transfer learning and a bespoke loss function to facilitate the end-to-end detection of objects in these challenging scenarios without the need to convert non-ideal images into their RGB counterparts. In our methodology, we initially train a comprehensive model on a pristine RGB image dataset. Subsequently, non-ideal images are processed by comparing their feature maps against those from the initial ideal RGB model. This comparison employs the Extended Area Novel Structural Discrepancy Loss (EANSDL), a novel loss function designed to quantify similarities and integrate them into the detection loss. This approach refines the model's ability to perform object detection across varying conditions through direct feature map correction, encapsulating the essence of Feature Corrective Transfer Learning. Experimental validation on variants of the KITTI dataset demonstrates a significant improvement in mean Average Precision (mAP), resulting in a 3.8-8.1% relative enhancement in detection under non-ideal conditions compared to the baseline model, and a less marginal performance difference within 1.3% of the mAP@[0.5:0.95] achieved under ideal conditions by the standard Faster RCNN algorithm.",2404.11214,http://arxiv.org/abs/2404.11214v1,2024-04-17 09:58:53+00:00,2024-04-17 09:58:53+00:00,cs.CV,"['cs.CV', 'cs.AI']",2
In-Context Learning State Vector with Inner and Momentum Optimization,"['Dongfang Li', 'Zhenyu Liu', 'Xinshuo Hu', 'Zetian Sun', 'Baotian Hu', 'Min Zhang']","Large Language Models (LLMs) have exhibited an impressive ability to perform In-Context Learning (ICL) from only a few examples. Recent works have indicated that the functions learned by ICL can be represented through compressed vectors derived from the transformer. However, the working mechanisms and optimization of these vectors are yet to be thoroughly explored. In this paper, we address this gap by presenting a comprehensive analysis of these compressed vectors, drawing parallels to the parameters trained with gradient descent, and introduce the concept of state vector. Inspired by the works on model soup and momentum-based gradient descent, we propose inner and momentum optimization methods that are applied to refine the state vector progressively as test-time adaptation. Moreover, we simulate state vector aggregation in the multiple example setting, where demonstrations comprising numerous examples are usually too lengthy for regular ICL, and further propose a divide-and-conquer aggregation method to address this challenge. We conduct extensive experiments using Llama-2 and GPT-J in both zero-shot setting and few-shot setting. The experimental results show that our optimization method effectively enhances the state vector and achieves the state-of-the-art performance on diverse tasks. Code is available at https://github.com/HITsz-TMG/ICL-State-Vector",2404.11225,http://arxiv.org/abs/2404.11225v1,2024-04-17 10:19:15+00:00,2024-04-17 10:19:15+00:00,cs.CL,"['cs.CL', 'cs.AI']",17
Energy-Efficient Uncertainty-Aware Biomass Composition Prediction at the Edge,"['Muhammad Zawish', 'Paul Albert', 'Flavio Esposito', 'Steven Davy', 'Lizy Abraham']","Clover fixates nitrogen from the atmosphere to the ground, making grass-clover mixtures highly desirable to reduce external nitrogen fertilization. Herbage containing clover additionally promotes higher food intake, resulting in higher milk production. Herbage probing however remains largely unused as it requires a time-intensive manual laboratory analysis. Without this information, farmers are unable to perform localized clover sowing or take targeted fertilization decisions. Deep learning algorithms have been proposed with the goal to estimate the dry biomass composition from images of the grass directly in the fields. The energy-intensive nature of deep learning however limits deployment to practical edge devices such as smartphones. This paper proposes to fill this gap by applying filter pruning to reduce the energy requirement of existing deep learning solutions. We report that although pruned networks are accurate on controlled, high-quality images of the grass, they struggle to generalize to real-world smartphone images that are blurry or taken from challenging angles. We address this challenge by training filter-pruned models using a variance attenuation loss so they can predict the uncertainty of their predictions. When the uncertainty exceeds a threshold, we re-infer using a more accurate unpruned model. This hybrid approach allows us to reduce energy consumption while retaining a high accuracy. We evaluate our algorithm on two datasets: the GrassClover and the Irish clover using an NVIDIA Jetson Nano edge device. We find that we reduce energy reduction with respect to state-of-the-art solutions by 50% on average with only 4% accuracy loss.",2404.1123,http://arxiv.org/abs/2404.11230v1,2024-04-17 10:26:49+00:00,2024-04-17 10:26:49+00:00,cs.CV,"['cs.CV', 'cs.AI']",0
DACAD: Domain Adaptation Contrastive Learning for Anomaly Detection in Multivariate Time Series,"['Zahra Zamanzadeh Darban', 'Geoffrey I. Webb', 'Mahsa Salehi']","Time series anomaly detection (TAD) faces a significant challenge due to the scarcity of labelled data, which hinders the development of accurate detection models. Unsupervised domain adaptation (UDA) addresses this challenge by leveraging a labelled dataset from a related domain to detect anomalies in a target dataset. Existing domain adaptation techniques assume that the number of anomalous classes does not change between the source and target domains. In this paper, we propose a novel Domain Adaptation Contrastive learning for Anomaly Detection in multivariate time series (DACAD) model to address this issue by combining UDA and contrastive representation learning. DACAD's approach includes an anomaly injection mechanism that introduces various types of synthetic anomalies, enhancing the model's ability to generalise across unseen anomalous classes in different domains. This method significantly broadens the model's adaptability and robustness. Additionally, we propose a supervised contrastive loss for the source domain and a self-supervised contrastive triplet loss for the target domain, improving comprehensive feature representation learning and extraction of domain-invariant features. Finally, an effective Centre-based Entropy Classifier (CEC) is proposed specifically for anomaly detection, facilitating accurate learning of normal boundaries in the source domain. Our extensive evaluation across multiple real-world datasets against leading models in time series anomaly detection and UDA underscores DACAD's effectiveness. The results validate DACAD's superiority in transferring knowledge across domains and its potential to mitigate the challenge of limited labelled data in time series anomaly detection.",2404.11269,http://arxiv.org/abs/2404.11269v1,2024-04-17 11:20:14+00:00,2024-04-17 11:20:14+00:00,cs.LG,"['cs.LG', 'cs.AI']",0
Improving Composed Image Retrieval via Contrastive Learning with Scaling Positives and Negatives,"['Zhangchi Feng', 'Richong Zhang', 'Zhijie Nie']","The Composed Image Retrieval (CIR) task aims to retrieve target images using a composed query consisting of a reference image and a modified text. Advanced methods often utilize contrastive learning as the optimization objective, which benefits from adequate positive and negative examples. However, the triplet for CIR incurs high manual annotation costs, resulting in limited positive examples. Furthermore, existing methods commonly use in-batch negative sampling, which reduces the negative number available for the model. To address the problem of lack of positives, we propose a data generation method by leveraging a multi-modal large language model to construct triplets for CIR. To introduce more negatives during fine-tuning, we design a two-stage fine-tuning framework for CIR, whose second stage introduces plenty of static representations of negatives to optimize the representation space rapidly. The above two improvements can be effectively stacked and designed to be plug-and-play, easily applied to existing CIR models without changing their original architectures. Extensive experiments and ablation analysis demonstrate that our method effectively scales positives and negatives and achieves state-of-the-art results on both FashionIQ and CIRR datasets. In addition, our methods also perform well in zero-shot composed image retrieval, providing a new CIR solution for the low-resources scenario.",2404.11317,http://arxiv.org/abs/2404.11317v1,2024-04-17 12:30:54+00:00,2024-04-17 12:30:54+00:00,cs.CV,"['cs.CV', 'cs.AI']",0
"Calibrating Bayesian Learning via Regularization, Confidence Minimization, and Selective Inference","['Jiayi Huang', 'Sangwoo Park', 'Osvaldo Simeone']","The application of artificial intelligence (AI) models in fields such as engineering is limited by the known difficulty of quantifying the reliability of an AI's decision. A well-calibrated AI model must correctly report its accuracy on in-distribution (ID) inputs, while also enabling the detection of out-of-distribution (OOD) inputs. A conventional approach to improve calibration is the application of Bayesian ensembling. However, owing to computational limitations and model misspecification, practical ensembling strategies do not necessarily enhance calibration. This paper proposes an extension of variational inference (VI)-based Bayesian learning that integrates calibration regularization for improved ID performance, confidence minimization for OOD detection, and selective calibration to ensure a synergistic use of calibration regularization and confidence minimization. The scheme is constructed successively by first introducing calibration-regularized Bayesian learning (CBNN), then incorporating out-of-distribution confidence minimization (OCM) to yield CBNN-OCM, and finally integrating also selective calibration to produce selective CBNN-OCM (SCBNN-OCM). Selective calibration rejects inputs for which the calibration performance is expected to be insufficient. Numerical results illustrate the trade-offs between ID accuracy, ID calibration, and OOD calibration attained by both frequentist and Bayesian learning methods. Among the main conclusions, SCBNN-OCM is seen to achieve best ID and OOD performance as compared to existing state-of-the-art approaches at the cost of rejecting a sufficiently large number of inputs.",2404.1135,http://arxiv.org/abs/2404.11350v1,2024-04-17 13:08:26+00:00,2024-04-17 13:08:26+00:00,cs.LG,"['cs.LG', 'cs.AI', 'eess.SP']",0
Using Game Engines and Machine Learning to Create Synthetic Satellite Imagery for a Tabletop Verification Exercise,"['Johannes Hoster', 'Sara Al-Sayed', 'Felix Biessmann', 'Alexander Glaser', 'Kristian Hildebrand', 'Igor Moric', 'Tuong Vy Nguyen']","Satellite imagery is regarded as a great opportunity for citizen-based monitoring of activities of interest. Relevant imagery may however not be available at sufficiently high resolution, quality, or cadence -- let alone be uniformly accessible to open-source analysts. This limits an assessment of the true long-term potential of citizen-based monitoring of nuclear activities using publicly available satellite imagery. In this article, we demonstrate how modern game engines combined with advanced machine-learning techniques can be used to generate synthetic imagery of sites of interest with the ability to choose relevant parameters upon request; these include time of day, cloud cover, season, or level of activity onsite. At the same time, resolution and off-nadir angle can be adjusted to simulate different characteristics of the satellite. While there are several possible use-cases for synthetic imagery, here we focus on its usefulness to support tabletop exercises in which simple monitoring scenarios can be examined to better understand verification capabilities enabled by new satellite constellations and very short revisit times.",2404.11461,http://arxiv.org/abs/2404.11461v1,2024-04-17 15:09:31+00:00,2024-04-17 15:09:31+00:00,cs.CV,"['cs.CV', 'cs.AI', 'cs.HC', 'cs.LG']",24
AdaIR: Exploiting Underlying Similarities of Image Restoration Tasks with Adapters,"['Hao-Wei Chen', 'Yu-Syuan Xu', 'Kelvin C. K. Chan', 'Hsien-Kai Kuo', 'Chun-Yi Lee', 'Ming-Hsuan Yang']","Existing image restoration approaches typically employ extensive networks specifically trained for designated degradations. Despite being effective, such methods inevitably entail considerable storage costs and computational overheads due to the reliance on task-specific networks. In this work, we go beyond this well-established framework and exploit the inherent commonalities among image restoration tasks. The primary objective is to identify components that are shareable across restoration tasks and augment the shared components with modules specifically trained for individual tasks. Towards this goal, we propose AdaIR, a novel framework that enables low storage cost and efficient training without sacrificing performance. Specifically, a generic restoration network is first constructed through self-supervised pre-training using synthetic degradations. Subsequent to the pre-training phase, adapters are trained to adapt the pre-trained network to specific degradations. AdaIR requires solely the training of lightweight, task-specific modules, ensuring a more efficient storage and training regimen. We have conducted extensive experiments to validate the effectiveness of AdaIR and analyze the influence of the pre-training strategy on discovering shareable components. Extensive experimental results show that AdaIR achieves outstanding results on multi-task restoration while utilizing significantly fewer parameters (1.9 MB) and less training time (7 hours) for each restoration task. The source codes and trained models will be released.",2404.11475,http://arxiv.org/abs/2404.11475v1,2024-04-17 15:31:06+00:00,2024-04-17 15:31:06+00:00,cs.CV,"['cs.CV', 'cs.AI']",0
"Runtime Analysis of Evolutionary Diversity Optimization on the Multi-objective (LeadingOnes, TrailingZeros) Problem","['Denis Antipov', 'Aneta Neumann', 'Frank Neumann. Andrew M. Sutton']","The diversity optimization is the class of optimization problems, in which we aim at finding a diverse set of good solutions. One of the frequently used approaches to solve such problems is to use evolutionary algorithms which evolve a desired diverse population. This approach is called evolutionary diversity optimization (EDO).   In this paper, we analyse EDO on a 3-objective function LOTZ$_k$, which is a modification of the 2-objective benchmark function (LeadingOnes, TrailingZeros). We prove that the GSEMO computes a set of all Pareto-optimal solutions in $O(kn^3)$ expected iterations. We also analyze the runtime of the GSEMO$_D$ (a modification of the GSEMO for diversity optimization) until it finds a population with the best possible diversity for two different diversity measures, the total imbalance and the sorted imbalances vector. For the first measure we show that the GSEMO$_D$ optimizes it asymptotically faster than it finds a Pareto-optimal population, in $O(kn^2\log(n))$ expected iterations, and for the second measure we show an upper bound of $O(k^2n^3\log(n))$ expected iterations. We complement our theoretical analysis with an empirical study, which shows a very similar behavior for both diversity measures that is close to the theory predictions.",2404.11496,http://arxiv.org/abs/2404.11496v1,2024-04-17 15:51:15+00:00,2024-04-17 15:51:15+00:00,cs.NE,"['cs.NE', 'cs.AI']",15
A Data-Driven Representation for Sign Language Production,"['Harry Walsh', 'Abolfazl Ravanshad', 'Mariam Rahmani', 'Richard Bowden']","Phonetic representations are used when recording spoken languages, but no equivalent exists for recording signed languages. As a result, linguists have proposed several annotation systems that operate on the gloss or sub-unit level; however, these resources are notably irregular and scarce.   Sign Language Production (SLP) aims to automatically translate spoken language sentences into continuous sequences of sign language. However, current state-of-the-art approaches rely on scarce linguistic resources to work. This has limited progress in the field. This paper introduces an innovative solution by transforming the continuous pose generation problem into a discrete sequence generation problem. Thus, overcoming the need for costly annotation. Although, if available, we leverage the additional information to enhance our approach.   By applying Vector Quantisation (VQ) to sign language data, we first learn a codebook of short motions that can be combined to create a natural sequence of sign. Where each token in the codebook can be thought of as the lexicon of our representation. Then using a transformer we perform a translation from spoken language text to a sequence of codebook tokens. Each token can be directly mapped to a sequence of poses allowing the translation to be performed by a single network. Furthermore, we present a sign stitching method to effectively join tokens together. We evaluate on the RWTH-PHOENIX-Weather-2014T (PHOENIX14T) and the more challenging Meine DGS Annotated (mDGS) datasets. An extensive evaluation shows our approach outperforms previous methods, increasing the BLEU-1 back translation score by up to 72%.",2404.11499,http://arxiv.org/abs/2404.11499v1,2024-04-17 15:52:38+00:00,2024-04-17 15:52:38+00:00,cs.CL,"['cs.CL', 'cs.AI']",0
