title,authors,abstract,arxiv_id,link,date_published,date_updated,primary_category,categories,max_author_hindex
ViLLM-Eval: A Comprehensive Evaluation Suite for Vietnamese Large Language Models,"['Trong-Hieu Nguyen', 'Anh-Cuong Le', 'Viet-Cuong Nguyen']","The rapid advancement of large language models (LLMs) necessitates the development of new benchmarks to accurately assess their capabilities. To address this need for Vietnamese, this work aims to introduce ViLLM-Eval, the comprehensive evaluation suite designed to measure the advanced knowledge and reasoning abilities of foundation models within a Vietnamese context. ViLLM-Eval consists of multiple-choice questions and predict next word tasks spanning various difficulty levels and diverse disciplines, ranging from humanities to science and engineering. A thorough evaluation of the most advanced LLMs on ViLLM-Eval revealed that even the best performing models have significant room for improvement in understanding and responding to Vietnamese language tasks. ViLLM-Eval is believed to be instrumental in identifying key strengths and weaknesses of foundation models, ultimately promoting their development and enhancing their performance for Vietnamese users. This paper provides a thorough overview of ViLLM-Eval as part of the Vietnamese Large Language Model shared task, held within the 10th International Workshop on Vietnamese Language and Speech Processing (VLSP 2023).",2404.11086,http://arxiv.org/abs/2404.11086v2,2024-04-17 05:57:17+00:00,2024-04-18 07:41:23+00:00,cs.CL,"['cs.CL', 'cs.AI']",11
Inductive-Deductive Strategy Reuse for Multi-Turn Instructional Dialogues,"['Jiao Ou', 'Jiayu Wu', 'Che Liu', 'Fuzheng Zhang', 'Di Zhang', 'Kun Gai']","Aligning large language models (LLMs) with human expectations requires high-quality instructional dialogues, which can be achieved by raising diverse, in-depth, and insightful instructions that deepen interactions. Existing methods target instructions from real instruction dialogues as a learning goal and fine-tune a user simulator for posing instructions. However, the user simulator struggles to implicitly model complex dialogue flows and pose high-quality instructions. In this paper, we take inspiration from the cognitive abilities inherent in human learning and propose the explicit modeling of complex dialogue flows through instructional strategy reuse. Specifically, we first induce high-level strategies from various real instruction dialogues. These strategies are applied to new dialogue scenarios deductively, where the instructional strategies facilitate high-quality instructions. Experimental results show that our method can generate diverse, in-depth, and insightful instructions for a given dialogue history. The constructed multi-turn instructional dialogues can outperform competitive baselines on the downstream chat model.",2404.11095,http://arxiv.org/abs/2404.11095v1,2024-04-17 06:26:32+00:00,2024-04-17 06:26:32+00:00,cs.CL,"['cs.CL', 'cs.AI']",0
TransLinkGuard: Safeguarding Transformer Models Against Model Stealing in Edge Deployment,"['Qinfeng Li', 'Zhiqiang Shen', 'Zhenghan Qin', 'Yangfan Xie', 'Xuhong Zhang', 'Tianyu Du', 'Jianwei Yin']","Proprietary large language models (LLMs) have been widely applied in various scenarios. Additionally, deploying LLMs on edge devices is trending for efficiency and privacy reasons. However, edge deployment of proprietary LLMs introduces new security challenges: edge-deployed models are exposed as white-box accessible to users, enabling adversaries to conduct effective model stealing (MS) attacks. Unfortunately, existing defense mechanisms fail to provide effective protection. Specifically, we identify four critical protection properties that existing methods fail to simultaneously satisfy: (1) maintaining protection after a model is physically copied; (2) authorizing model access at request level; (3) safeguarding runtime reverse engineering; (4) achieving high security with negligible runtime overhead. To address the above issues, we propose TransLinkGuard, a plug-and-play model protection approach against model stealing on edge devices. The core part of TransLinkGuard is a lightweight authorization module residing in a secure environment, e.g., TEE. The authorization module can freshly authorize each request based on its input. Extensive experiments show that TransLinkGuard achieves the same security protection as the black-box security guarantees with negligible overhead.",2404.11121,http://arxiv.org/abs/2404.11121v1,2024-04-17 07:08:45+00:00,2024-04-17 07:08:45+00:00,cs.CR,"['cs.CR', 'cs.AI']",17
Personalized Heart Disease Detection via ECG Digital Twin Generation,"['Yaojun Hu', 'Jintai Chen', 'Lianting Hu', 'Dantong Li', 'Jiahuan Yan', 'Haochao Ying', 'Huiying Liang', 'Jian Wu']","Heart diseases rank among the leading causes of global mortality, demonstrating a crucial need for early diagnosis and intervention. Most traditional electrocardiogram (ECG) based automated diagnosis methods are trained at population level, neglecting the customization of personalized ECGs to enhance individual healthcare management. A potential solution to address this limitation is to employ digital twins to simulate symptoms of diseases in real patients. In this paper, we present an innovative prospective learning approach for personalized heart disease detection, which generates digital twins of healthy individuals' anomalous ECGs and enhances the model sensitivity to the personalized symptoms. In our approach, a vector quantized feature separator is proposed to locate and isolate the disease symptom and normal segments in ECG signals with ECG report guidance. Thus, the ECG digital twins can simulate specific heart diseases used to train a personalized heart disease detection model. Experiments demonstrate that our approach not only excels in generating high-fidelity ECG signals but also improves personalized heart disease detection. Moreover, our approach ensures robust privacy protection, safeguarding patient data in model development.",2404.11171,http://arxiv.org/abs/2404.11171v1,2024-04-17 08:40:54+00:00,2024-04-17 08:40:54+00:00,cs.LG,"['cs.LG', 'cs.AI', 'eess.SP']",0
Revisiting Noise Resilience Strategies in Gesture Recognition: Short-Term Enhancement in Surface Electromyographic Signal Analysis,"['Weiyu Guo', 'Ziyue Qiao', 'Ying Sun', 'Hui Xiong']","Gesture recognition based on surface electromyography (sEMG) has been gaining importance in many 3D Interactive Scenes. However, sEMG is easily influenced by various forms of noise in real-world environments, leading to challenges in providing long-term stable interactions through sEMG. Existing methods often struggle to enhance model noise resilience through various predefined data augmentation techniques. In this work, we revisit the problem from a short term enhancement perspective to improve precision and robustness against various common noisy scenarios with learnable denoise using sEMG intrinsic pattern information and sliding-window attention. We propose a Short Term Enhancement Module(STEM) which can be easily integrated with various models. STEM offers several benefits: 1) Learnable denoise, enabling noise reduction without manual data augmentation; 2) Scalability, adaptable to various models; and 3) Cost-effectiveness, achieving short-term enhancement through minimal weight-sharing in an efficient attention mechanism. In particular, we incorporate STEM into a transformer, creating the Short Term Enhanced Transformer (STET). Compared with best-competing approaches, the impact of noise on STET is reduced by more than 20%. We also report promising results on both classification and regression datasets and demonstrate that STEM generalizes across different gesture recognition tasks.",2404.11213,http://arxiv.org/abs/2404.11213v1,2024-04-17 09:57:40+00:00,2024-04-17 09:57:40+00:00,eess.SP,"['eess.SP', 'cs.AI']",8
Position Engineering: Boosting Large Language Models through Positional Information Manipulation,"['Zhiyuan He', 'Huiqiang Jiang', 'Zilong Wang', 'Yuqing Yang', 'Luna Qiu', 'Lili Qiu']","The performance of large language models (LLMs) is significantly influenced by the quality of the prompts provided. In response, researchers have developed enormous prompt engineering strategies aimed at modifying the prompt text to enhance task performance. In this paper, we introduce a novel technique termed position engineering, which offers a more efficient way to guide large language models. Unlike prompt engineering, which requires substantial effort to modify the text provided to LLMs, position engineering merely involves altering the positional information in the prompt without modifying the text itself. We have evaluated position engineering in two widely-used LLM scenarios: retrieval-augmented generation (RAG) and in-context learning (ICL). Our findings show that position engineering substantially improves upon the baseline in both cases. Position engineering thus represents a promising new strategy for exploiting the capabilities of large language models.",2404.11216,http://arxiv.org/abs/2404.11216v1,2024-04-17 10:00:56+00:00,2024-04-17 10:00:56+00:00,cs.CL,"['cs.CL', 'cs.AI', 'cs.LG']",16
Optical Image-to-Image Translation Using Denoising Diffusion Models: Heterogeneous Change Detection as a Use Case,"['João Gabriel Vinholi', 'Marco Chini', 'Anis Amziane', 'Renato Machado', 'Danilo Silva', 'Patrick Matgen']","We introduce an innovative deep learning-based method that uses a denoising diffusion-based model to translate low-resolution images to high-resolution ones from different optical sensors while preserving the contents and avoiding undesired artifacts. The proposed method is trained and tested on a large and diverse data set of paired Sentinel-II and Planet Dove images. We show that it can solve serious image generation issues observed when the popular classifier-free guided Denoising Diffusion Implicit Model (DDIM) framework is used in the task of Image-to-Image Translation of multi-sensor optical remote sensing images and that it can generate large images with highly consistent patches, both in colors and in features. Moreover, we demonstrate how our method improves heterogeneous change detection results in two urban areas: Beirut, Lebanon, and Austin, USA. Our contributions are: i) a new training and testing algorithm based on denoising diffusion models for optical image translation; ii) a comprehensive image quality evaluation and ablation study; iii) a comparison with the classifier-free guided DDIM framework; and iv) change detection experiments on heterogeneous data.",2404.11243,http://arxiv.org/abs/2404.11243v1,2024-04-17 10:49:00+00:00,2024-04-17 10:49:00+00:00,cs.CV,"['cs.CV', 'cs.AI']",0
Characterizing and modeling harms from interactions with design patterns in AI interfaces,"['Lujain Ibrahim', 'Luc Rocher', 'Ana Valdivia']","The proliferation of applications using artificial intelligence (AI) systems has led to a growing number of users interacting with these systems through sophisticated interfaces. Human-computer interaction research has long shown that interfaces shape both user behavior and user perception of technical capabilities and risks. Yet, practitioners and researchers evaluating the social and ethical risks of AI systems tend to overlook the impact of anthropomorphic, deceptive, and immersive interfaces on human-AI interactions. Here, we argue that design features of interfaces with adaptive AI systems can have cascading impacts, driven by feedback loops, which extend beyond those previously considered. We first conduct a scoping review of AI interface designs and their negative impact to extract salient themes of potentially harmful design patterns in AI interfaces. Then, we propose Design-Enhanced Control of AI systems (DECAI), a conceptual model to structure and facilitate impact assessments of AI interface designs. DECAI draws on principles from control systems theory -- a theory for the analysis and design of dynamic physical systems -- to dissect the role of the interface in human-AI systems. Through two case studies on recommendation systems and conversational language model systems, we show how DECAI can be used to evaluate AI interface designs.",2404.1137,http://arxiv.org/abs/2404.11370v1,2024-04-17 13:30:45+00:00,2024-04-17 13:30:45+00:00,cs.HC,"['cs.HC', 'cs.AI', 'cs.CY']",0
Short-term wind speed forecasting model based on an attention-gated recurrent neural network and error correction strategy,['Haojian Huang'],"The accurate wind speed series forecast is very pivotal to security of grid dispatching and the application of wind power. Nevertheless, on account of their nonlinear and non-stationary nature, their short-term forecast is extremely challenging. Therefore, this dissertation raises one short-term wind speed forecast pattern on the foundation of attention with an improved gated recurrent neural network (AtGRU) and a tactic of error correction. That model uses the AtGRU model as the preliminary predictor and the GRU model as the error corrector. At the beginning, SSA (singular spectrum analysis) is employed in previous wind speed series for lessening the noise. Subsequently, historical wind speed series is going to be used for the predictor training. During this process, the prediction can have certain errors. The sequence of these errors processed by variational modal decomposition (VMD) is used to train the corrector of error. The eventual forecast consequence is just the sum of predictor forecast and error corrector. The proposed SSA-AtGRU-VMD-GRU model outperforms the compared models in three case studies on Woodburn, St. Thomas, and Santa Cruz. It is indicated that the model evidently enhances the correction of the wind speed forecast.",2404.11422,http://arxiv.org/abs/2404.11422v1,2024-04-17 14:27:45+00:00,2024-04-17 14:27:45+00:00,cs.LG,"['cs.LG', 'cs.AI', 'physics.ao-ph']",2
Open-Ended Wargames with Large Language Models,"['Daniel P. Hogan', 'Andrea Brennen']","Wargames are a powerful tool for understanding and rehearsing real-world decision making. Automated play of wargames using artificial intelligence (AI) enables possibilities beyond those of human-conducted games, such as playing the game many times over to see a range of possible outcomes. There are two categories of wargames: quantitative games, with discrete types of moves, and qualitative games, which revolve around open-ended responses. Historically, automation efforts have focused on quantitative games, but large language models (LLMs) make it possible to automate qualitative wargames. We introduce ""Snow Globe,"" an LLM-powered multi-agent system for playing qualitative wargames. With Snow Globe, every stage of a text-based qualitative wargame from scenario preparation to post-game analysis can be optionally carried out by AI, humans, or a combination thereof. We describe its software architecture conceptually and release an open-source implementation alongside this publication. As case studies, we simulate a tabletop exercise about an AI incident response and a political wargame about a geopolitical crisis. We discuss potential applications of the approach and how it fits into the broader wargaming ecosystem.",2404.11446,http://arxiv.org/abs/2404.11446v1,2024-04-17 14:54:58+00:00,2024-04-17 14:54:58+00:00,cs.CL,"['cs.CL', 'cs.AI', 'cs.CY']",3
Discovering Nuclear Models from Symbolic Machine Learning,"['Jose M. Munoz', 'Silviu M. Udrescu', 'Ronald F. Garcia Ruiz']","Numerous phenomenological nuclear models have been proposed to describe specific observables within different regions of the nuclear chart. However, developing a unified model that describes the complex behavior of all nuclei remains an open challenge. Here, we explore whether novel symbolic Machine Learning (ML) can rediscover traditional nuclear physics models or identify alternatives with improved simplicity, fidelity, and predictive power. To address this challenge, we developed a Multi-objective Iterated Symbolic Regression approach that handles symbolic regressions over multiple target observables, accounts for experimental uncertainties and is robust against high-dimensional problems. As a proof of principle, we applied this method to describe the nuclear binding energies and charge radii of light and medium mass nuclei. Our approach identified simple analytical relationships based on the number of protons and neutrons, providing interpretable models with precision comparable to state-of-the-art nuclear models. Additionally, we integrated this ML-discovered model with an existing complementary model to estimate the limits of nuclear stability. These results highlight the potential of symbolic ML to develop accurate nuclear models and guide our description of complex many-body problems.",2404.11477,http://arxiv.org/abs/2404.11477v1,2024-04-17 15:32:58+00:00,2024-04-17 15:32:58+00:00,nucl-th,"['nucl-th', 'cs.AI', 'cs.LG', 'nucl-ex']",23
Multi-resolution Rescored ByteTrack for Video Object Detection on Ultra-low-power Embedded Systems,"['Luca Bompani', 'Manuele Rusci', 'Daniele Palossi', 'Francesco Conti', 'Luca Benini']","This paper introduces Multi-Resolution Rescored Byte-Track (MR2-ByteTrack), a novel video object detection framework for ultra-low-power embedded processors. This method reduces the average compute load of an off-the-shelf Deep Neural Network (DNN) based object detector by up to 2.25$\times$ by alternating the processing of high-resolution images (320$\times$320 pixels) with multiple down-sized frames (192$\times$192 pixels). To tackle the accuracy degradation due to the reduced image input size, MR2-ByteTrack correlates the output detections over time using the ByteTrack tracker and corrects potential misclassification using a novel probabilistic Rescore algorithm. By interleaving two down-sized images for every high-resolution one as the input of different state-of-the-art DNN object detectors with our MR2-ByteTrack, we demonstrate an average accuracy increase of 2.16% and a latency reduction of 43% on the GAP9 microcontroller compared to a baseline frame-by-frame inference scheme using exclusively full-resolution images. Code available at: https://github.com/Bomps4/Multi_Resolution_Rescored_ByteTrack",2404.11488,http://arxiv.org/abs/2404.11488v1,2024-04-17 15:45:49+00:00,2024-04-17 15:45:49+00:00,cs.CV,"['cs.CV', 'cs.AI', 'I.4']",0
arcjetCV: an open-source software to analyze material ablation,"['Alexandre Quintart', 'Magnus Haw', 'Federico Semeraro']","arcjetCV is an open-source Python software designed to automate time-resolved measurements of heatshield material recession and recession rates from arcjet test video footage. This new automated and accessible capability greatly exceeds previous manual extraction methods, enabling rapid and detailed characterization of material recession for any sample with a profile video. arcjetCV automates the video segmentation process using machine learning models, including a one-dimensional (1D) Convolutional Neural Network (CNN) to infer the time-window of interest, a two-dimensional (2D) CNN for image and edge segmentation, and a Local Outlier Factor (LOF) for outlier filtering. A graphical user interface (GUI) simplifies the user experience and an application programming interface (API) allows users to call the core functions from scripts, enabling video batch processing. arcjetCV's capability to measure time-resolved recession in turn enables characterization of non-linear processes (shrinkage, swelling, melt flows, etc.), contributing to higher fidelity validation and improved modeling of heatshield material performance. The source code associated with this article can be found at https://github.com/magnus-haw/arcjetCV.",2404.11492,http://arxiv.org/abs/2404.11492v1,2024-04-17 15:47:26+00:00,2024-04-17 15:47:26+00:00,cs.CV,"['cs.CV', 'cs.AI', 'cs.LG']",0
Paraphrase and Solve: Exploring and Exploiting the Impact of Surface Form on Mathematical Reasoning in Large Language Models,"['Yue Zhou', 'Yada Zhu', 'Diego Antognini', 'Yoon Kim', 'Yang Zhang']","This paper studies the relationship between the surface form of a mathematical problem and its solvability by large language models. We find that subtle alterations in the surface form can significantly impact the answer distribution and the solve rate, exposing the language model's lack of robustness and sensitivity to the surface form in reasoning through complex problems. To improve mathematical reasoning performance, we propose Self-Consistency-over-Paraphrases (SCoP), which diversifies reasoning paths from specific surface forms of the problem. We evaluate our approach on four mathematics reasoning benchmarks over three large language models and show that SCoP improves mathematical reasoning performance over vanilla self-consistency, particularly for problems initially deemed unsolvable. Finally, we provide additional experiments and discussion regarding problem difficulty and surface forms, including cross-model difficulty agreement and paraphrasing transferability, and Variance of Variations (VOV) for language model evaluation.",2404.115,http://arxiv.org/abs/2404.11500v1,2024-04-17 15:53:49+00:00,2024-04-17 15:53:49+00:00,cs.CL,"['cs.CL', 'cs.AI']",0
Towards Coarse-to-Fine Evaluation of Inference Efficiency for Large Language Models,"['Yushuo Chen', 'Tianyi Tang', 'Erge Xiang', 'Linjiang Li', 'Wayne Xin Zhao', 'Jing Wang', 'Yunpeng Chai', 'Ji-Rong Wen']","In real world, large language models (LLMs) can serve as the assistant to help users accomplish their jobs, and also support the development of advanced applications. For the wide application of LLMs, the inference efficiency is an essential concern, which has been widely studied in existing work, and numerous optimization algorithms and code libraries have been proposed to improve it. Nonetheless, users still find it challenging to compare the effectiveness of all the above methods and understand the underlying mechanisms. In this work, we perform a detailed coarse-to-fine analysis of the inference performance of various code libraries. To evaluate the overall effectiveness, we examine four usage scenarios within two practical applications. We further provide both theoretical and empirical fine-grained analyses of each module in the Transformer architecture. Our experiments yield comprehensive results that are invaluable for researchers to evaluate code libraries and improve inference strategies.",2404.11502,http://arxiv.org/abs/2404.11502v1,2024-04-17 15:57:50+00:00,2024-04-17 15:57:50+00:00,cs.CL,"['cs.CL', 'cs.AI']",10
Decomposing and Editing Predictions by Modeling Model Computation,"['Harshay Shah', 'Andrew Ilyas', 'Aleksander Madry']","How does the internal computation of a machine learning model transform inputs into predictions? In this paper, we introduce a task called component modeling that aims to address this question. The goal of component modeling is to decompose an ML model's prediction in terms of its components -- simple functions (e.g., convolution filters, attention heads) that are the ""building blocks"" of model computation. We focus on a special case of this task, component attribution, where the goal is to estimate the counterfactual impact of individual components on a given prediction. We then present COAR, a scalable algorithm for estimating component attributions; we demonstrate its effectiveness across models, datasets, and modalities. Finally, we show that component attributions estimated with COAR directly enable model editing across five tasks, namely: fixing model errors, ``forgetting'' specific classes, boosting subpopulation robustness, localizing backdoor attacks, and improving robustness to typographic attacks. We provide code for COAR at https://github.com/MadryLab/modelcomponents .",2404.11534,http://arxiv.org/abs/2404.11534v1,2024-04-17 16:28:08+00:00,2024-04-17 16:28:08+00:00,cs.LG,"['cs.LG', 'cs.AI', 'stat.ML']",0
FedPFT: Federated Proxy Fine-Tuning of Foundation Models,"['Zhaopeng Peng', 'Xiaoliang Fan', 'Yufan Chen', 'Zheng Wang', 'Shirui Pan', 'Chenglu Wen', 'Ruisheng Zhang', 'Cheng Wang']","Adapting Foundation Models (FMs) for downstream tasks through Federated Learning (FL) emerges a promising strategy for protecting data privacy and valuable FMs. Existing methods fine-tune FM by allocating sub-FM to clients in FL, however, leading to suboptimal performance due to insufficient tuning and inevitable error accumulations of gradients. In this paper, we propose Federated Proxy Fine-Tuning (FedPFT), a novel method enhancing FMs adaptation in downstream tasks through FL by two key modules. First, the sub-FM construction module employs a layer-wise compression approach, facilitating comprehensive FM fine-tuning across all layers by emphasizing those crucial neurons. Second, the sub-FM alignment module conducts a two-step distillations-layer-level and neuron-level-before and during FL fine-tuning respectively, to reduce error of gradient by accurately aligning sub-FM with FM under theoretical guarantees. Experimental results on seven commonly used datasets (i.e., four text and three vision) demonstrate the superiority of FedPFT.",2404.11536,http://arxiv.org/abs/2404.11536v1,2024-04-17 16:30:06+00:00,2024-04-17 16:30:06+00:00,cs.LG,"['cs.LG', 'cs.AI']",0
